{
    "red_part": "https://i.ibb.co/CbvtCv0/ip.png",
    "red_positive_prompt": "anime illustration of a young woman with a black jacket",
    "red_negative_prompt": "ugly",
    "red_threshold": 0.15,
    "red_image_weight": 0.7,
    "red_prompt_weight": 1,
    "green_part": "https://i.ibb.co/d60TzcL/ip2.png",
    "green_positive_prompt": "illustration of a blond woman",
    "green_negative_prompt": "anime",
    "green_threshold": 0.15,
    "green_image_weight": 0.7,
    "green_prompt_weight": 1,
    "black_part": "https://i.ibb.co/st1ZCg9/back1.png",
    "black_positive_prompt": "closeup of two girl friends shopping in a sci-fi space station",
    "black_negative_prompt": "blurry, lowres, bad art, ill, distorted, malformed, horror",
    "black_threshold": 0.15,
    "black_image_weight": 0.7,
    "black_prompt_weight": 1,
    "color_mask": "https://i.ibb.co/0jBsstS/color-mask.png",
    "seed": 543543,
    "steps": 30,
    "cfg": 7,
    "sampler_name": "dpmpp_2m",
    "scheduler": "karras",
    "width": 512,
    "height": 512,
    "image_denoise": 1,
    "latent_upscale": true,
    "latent_upscale_size": 1.5,
    "latent_upscale_denoise": 0.55
}